<?xml version="1.0" encoding="UTF-8"?>
<!-- edited with XMLSPY v2004 rel. 3 U (http://www.xmlspy.com) by Mats Nordgren (IMI) -->
<!--Sample XML file generated by XMLSPY v2004 rel. 3 U (http://www.xmlspy.com)-->
<MessageDefinition xmlns:xsi="http://www.w3.org/2001/XMLSchema-instance" xsi:noNamespaceSchemaLocation="..\xsd\StructureDescription.xsd" name="InBound" version="1.0.0.0">
	<interfaces>
		<interface name="Order" structure="Order" HAPIObjectName="1" direction="In"/>
		<interface name="Node_Party" structure="Node_Party" HAPIObjectName="2" direction="In"/>
	</interfaces>
	<structures>
		<structure name="Order" insertSP="TAPI_OS.New_Order" updateSP="TAPI_OS.Modify_Order" deleteSP="TAPI_OS.Remove_Order" queueTable="" baseTable="">
			<comment>
				<line>Order</line>
			</comment>
		</structure>
		<structure name="Node_Party" insertSP="TAPI_OS.New_Modify_Node_Party" updateSP="TAPI_OS.New_Modify_Node_Party" deleteSP="TAPI_OS.Remove_Node_Party" queueTable="" baseTable="">
			<comment>
				<line>Node Party</line>
			</comment>
		</structure>
	</structures>
</MessageDefinition>
